{
  "relations": [
    {
      "target_id": "01J8ZK9A000000000000000001",
      "type": "contradicts",
      "confidence": 0.72,
      "reason": "States a flat 10% discount, while the target caps discounts at 5%."
    }
  ],
  "concepts": [
    {
      "name": "Pricing",
      "existing_id": null,
      "confidence": 0.8
    }
  ],
  "mentions": [
    {
      "text": "Shady",
      "kind": "person",
      "existing_id": "01J8ZKS0000000000000000001",
      "candidate_ids": [],
      "is_nickname": false,
      "confidence": 0.93,
      "evidence_block_id": "b1"
    },
    {
      "text": "Ahmed",
      "kind": "person",
      "existing_id": null,
      "candidate_ids": [
        "01J8ZKA0000000000000000001",
        "01J8ZKA0000000000000000002"
      ],
      "is_nickname": false,
      "confidence": 0.4,
      "evidence_block_id": "b2"
    }
  ],
  "entity_relations": [
    {
      "from": "Shady",
      "type": "works-at",
      "to": "Watanya",
      "confidence": 0.85,
      "reason": "The note says Shady handles Watanya's paperwork as their employee.",
      "evidence_block_id": "b1"
    }
  ],
  "custody": [
    {
      "type": "returned-by",
      "document": "Watanya's contract",
      "document_existing_id": "01J8ZKD0000000000000000001",
      "place": null,
      "place_existing_id": null,
      "place_part_of": null,
      "person": "Shady",
      "person_existing_id": "01J8ZKS0000000000000000001",
      "counterparty": null,
      "date": "2026-09-27",
      "date_source": "created",
      "confidence": 0.88,
      "evidence_block_id": "b1",
      "quote": "last with Shady"
    },
    {
      "type": "stored-at",
      "document": "Watanya's contract",
      "document_existing_id": "01J8ZKD0000000000000000001",
      "place": "the safe",
      "place_existing_id": "01J8ZKP0000000000000000002",
      "place_part_of": "Nasr City office",
      "person": null,
      "person_existing_id": null,
      "counterparty": null,
      "date": "2026-09-27",
      "date_source": "created",
      "confidence": 0.9,
      "evidence_block_id": "b1",
      "quote": "at the Nasr City office in the safe"
    }
  ],
  "tasks": [
    {
      "title": "Make Watanya's ETA invoice",
      "due": "2026-10-01",
      "date_source": "explicit",
      "recurrence": "every month on the 1st",
      "reminders": [
        "2026-10-01 09:00"
      ],
      "entities": [
        "Watanya"
      ],
      "confidence": 0.91,
      "evidence_block_id": "b3"
    }
  ]
}
